{
  "schema_version": "1.0.0",
  "run_id": "1-20260331-000615",
  "workflow_mode": "stable",
  "config_path": "/Users/jonyeock/Desktop/Tool/NumbersAuto/configs/1.json",
  "selected_unit": "사회_1_평화 통일을 위한 노력, 민주화와 산업화",
  "selected_lessons": [
    "1차시",
    "2차시",
    "3차시",
    "4차시",
    "5-6차시",
    "7차시",
    "8-9차시",
    "10차시",
    "11차시",
    "12-13차시",
    "14차시",
    "1차시",
    "2차시",
    "3차시",
    "4-5차시",
    "6-7차시",
    "8차시",
    "9-10차시",
    "11차시",
    "12차시",
    "13차시",
    "14차시",
    "15차시",
    "16차시",
    "17-18차시",
    "19차시",
    "1차시",
    "2-3차시",
    "4차시",
    "5차시",
    "6차시",
    "7차시",
    "8차시",
    "9차시",
    "10차시",
    "11차시",
    "12차시",
    "13차시",
    "14차시",
    "15차시"
  ],
  "stage_order": [
    "document_inventory_agent",
    "pdf_extract_agent",
    "page_index_agent",
    "schedule_parse_agent",
    "lesson_query_agent",
    "page_candidate_agent",
    "boundary_decision_agent",
    "boundary_validation_agent",
    "source_boundary_agent",
    "source_validation_agent",
    "lesson_analysis_agent",
    "lesson_review_agent",
    "activity_plan_agent",
    "activity_review_agent",
    "html_card_agent",
    "capture_agent",
    "numbers_compose_agent",
    "review_manifest_agent",
    "verify_agent"
  ],
  "started_at": "2026-03-30T15:06:15.714245+00:00",
  "finished_at": "2026-03-30T15:39:03.451707+00:00",
  "final_status": "success",
  "final_output_file": null,
  "status_summary": [
    {
      "stage": "document_inventory_agent",
      "status": "succeeded",
      "fallback_used": false,
      "warning_count": 0,
      "error_count": 0
    },
    {
      "stage": "pdf_extract_agent",
      "status": "succeeded",
      "fallback_used": false,
      "warning_count": 0,
      "error_count": 0
    },
    {
      "stage": "page_index_agent",
      "status": "succeeded",
      "fallback_used": false,
      "warning_count": 0,
      "error_count": 0
    },
    {
      "stage": "schedule_parse_agent",
      "status": "succeeded",
      "fallback_used": false,
      "warning_count": 0,
      "error_count": 0
    },
    {
      "stage": "lesson_query_agent",
      "status": "succeeded",
      "fallback_used": false,
      "warning_count": 0,
      "error_count": 0
    },
    {
      "stage": "page_candidate_agent",
      "status": "succeeded",
      "fallback_used": false,
      "warning_count": 0,
      "error_count": 0
    },
    {
      "stage": "boundary_decision_agent",
      "status": "succeeded_with_warning",
      "fallback_used": false,
      "warning_count": 1,
      "error_count": 0
    },
    {
      "stage": "boundary_validation_agent",
      "status": "succeeded_with_warning",
      "fallback_used": false,
      "warning_count": 63,
      "error_count": 0
    },
    {
      "stage": "source_boundary_agent",
      "status": "succeeded_with_warning",
      "fallback_used": false,
      "warning_count": 63,
      "error_count": 0
    },
    {
      "stage": "source_validation_agent",
      "status": "succeeded_with_warning",
      "fallback_used": false,
      "warning_count": 103,
      "error_count": 0
    },
    {
      "stage": "lesson_analysis_agent",
      "status": "succeeded_with_warning",
      "fallback_used": true,
      "warning_count": 26,
      "error_count": 0
    },
    {
      "stage": "lesson_review_agent",
      "status": "pending",
      "fallback_used": false,
      "warning_count": 0,
      "error_count": 0
    },
    {
      "stage": "activity_plan_agent",
      "status": "pending",
      "fallback_used": false,
      "warning_count": 0,
      "error_count": 0
    },
    {
      "stage": "activity_review_agent",
      "status": "pending",
      "fallback_used": false,
      "warning_count": 0,
      "error_count": 0
    },
    {
      "stage": "html_card_agent",
      "status": "pending",
      "fallback_used": false,
      "warning_count": 0,
      "error_count": 0
    },
    {
      "stage": "capture_agent",
      "status": "pending",
      "fallback_used": false,
      "warning_count": 0,
      "error_count": 0
    },
    {
      "stage": "numbers_compose_agent",
      "status": "pending",
      "fallback_used": false,
      "warning_count": 0,
      "error_count": 0
    },
    {
      "stage": "review_manifest_agent",
      "status": "pending",
      "fallback_used": false,
      "warning_count": 0,
      "error_count": 0
    },
    {
      "stage": "verify_agent",
      "status": "pending",
      "fallback_used": false,
      "warning_count": 0,
      "error_count": 0
    }
  ]
}
